{
    "id": "mythril_ore",
    "kind": "breakable_node",
    "sprite": "sprites/mythril.png",
    "yieldTable": [
        {"item": "mythril_chunk", "min": 1, "max": 3},
        {"item": "crystal_shard", "min": 0, "max": 1}
    ],
    "spawnRules": {
        "areas": ["crystal_cave"],
        "respawnPolicy": "daily",
        "seasonal": ["winter", "spring"]
    },
    "interaction": {
        "tool": "pickaxe",
        "scriptMode": "pick_node"
    }
}
